CPT Code,Description
27036,Capsulectomy of hip with excision of heterotopic bone and release of flexor muscle
27040,Biopsy of soft tissue of pelvis and hip area
27041,Biopsy of deep soft tissue of pelvis and hip area
27043,Excision of tumor of soft tissue of pelvis and hip area
27045,"Excision of intramuscular tumor of soft tissue of pelvis and hip area, 5 centimeters or greater"
27047,Excision of tumor of soft tissue of pelvis and hip
27048,Excision of tumor of soft tissue of pelvis and hip
27049,Radical resection of tumor of soft tissue of pelvis and hip
27050,Arthrotomy of sacroiliac joint with biopsy
27052,Arthrotomy of hip joint with biopsy
27054,Arthrotomy of hip joint with synovectomy
27057,Decompression fasciotomy of unilateral pelvic compartment with debridement of nonviable muscle
27059,Radical resection of tumor of soft tissue of pelvis and hip
27060,Excision of ischial bursa
27062,Excision of trochanteric bursa
27065,Excision of benign tumor of greater trochanter of femur
27066,Excision of benign tumor of greater trochanter of femur
27067,Excision of benign tumor of greater trochanter of femur with autograft
27070,Partial excision of greater trochanter of femur
27071,Partial excision of symphysis pubis
27075,Radical resection of tumor of wing of ilium
27076,Radical resection of tumor of ilium
27077,Radical resection of tumor with total excision of innominate bone
27078,Radical resection of tumor with excision of ischial tuberosity and greater trochanter of femur
27080,Primary coccygectomy
27086,Removal of foreign body of hip
27087,Removal of foreign body of hip
27090,Removal of hip prosthesis
27091,Removal of hip prosthesis
27093,Injection procedure for arthrography of hip
27095,Injection procedure for arthrography of hip under anesthesia
27096,Injection of anesthetic into sacroiliac joint using imaging guidance
27097,Recession of proximal hamstring muscle
27098,Transfer of adductor to ischium
27100,Transfer of external oblique muscle to greater trochanter with fascial extension graft
27105,Transfer of paraspinal muscle to hip
27110,Transfer of iliopsoas to greater trochanter of femur
27111,Transfer of iliopsoas to femoral neck
27120,Acetabuloplasty
27122,Acetabuloplasty with resection of femoral head
27125,Hemiarthroplasty of hip
27130,Total arthroplasty of hip with acetabular and proximal femoral prosthetic replacement
27132,Conversion to total hip arthroplasty
27134,Revision of total hip arthroplasty
27137,Revision of acetabular component of total hip arthroplasty
27138,Revision of femoral component of total hip arthroplasty
27140,Osteotomy and transfer of greater trochanter of femur
27146,Osteotomy of acetabular bone
27147,Osteotomy of acetabular bone with open reduction of hip
27151,Osteotomy of acetabular bone with femoral osteotomy
27156,Osteotomy of acetabular bone with femoral osteotomy and open reduction of hip
27158,Bilateral osteotomy of pelvis
27161,Osteotomy of femoral neck
27165,Intertrochanteric osteotomy with cast
27170,Bone graft to head of femur
27175,Treatment of slipped femoral epiphysis by traction
27176,Treatment of slipped femoral epiphysis by multiple pinning
27177,Open reduction of slipped femoral epiphysis with bone graft
27178,Open reduction of slipped femoral epiphysis by closed manipulation with fixation by multiple pinning
27179,Open reduction of slipped femoral epiphysis with osteoplasty of femoral neck
27181,Open reduction of slipped femoral epiphysis with osteotomy and internal fixation
27185,Epiphyseal arrest of greater trochanter of femur by epiphysiodesis
27187,Prophylactic treatment of femoral neck and proximal femur
27197,Closed reduction of dislocation of pelvis without manipulation
27198,Closed reduction of dislocation of pelvis with manipulation under epidural anesthesia
27200,Closed reduction of fracture of coccyx
27202,Open reduction of fracture of coccyx
27215,Open reduction of avulsion of unilateral iliac tuberosity
27216,Percutaneous skeletal fixation of fracture of unilateral posterior pelvic bone
27217,Open reduction of dislocation of unilateral anterior pelvic bone with internal fixation
27218,Open reduction of dislocation of unilateral posterior pelvic bone with internal fixation
27220,Closed reduction of fracture of acetabulum
27222,Closed reduction of fracture of acetabulum with manipulation
27226,Open reduction of fracture of anterior acetabular wall with internal fixation
27227,Open reduction of fracture of anterior column of acetabulum with internal fixation
27228,Open reduction of fracture of anterior column and wall of acetabulum with internal fixation
27230,Closed reduction of fracture of neck of femur
27232,Closed reduction of fracture of neck of femur with manipulation
27235,Percutaneous skeletal fixation of fracture of neck of femur
27236,Open reduction of fracture of proximal end of femur with internal fixation
27238,Closed reduction of intertrochanteric fracture of femur
27240,Closed reduction of intertrochanteric fracture of femur with manipulation
27244,Open reduction of intertrochanteric fracture of femur with fixation using implant with cerclage
27245,Open reduction of intertrochanteric fracture of femur with fixation using cerclage and intramedullary implant
27246,Closed reduction of fracture of greater trochanter of femur
27248,Open reduction of fracture of greater trochanter of femur
27250,Closed reduction of traumatic dislocation of hip
27252,Closed reduction of traumatic dislocation of hip under anesthesia
27253,Open reduction of traumatic dislocation of hip
27254,Open reduction of traumatic dislocation of hip with reduction of fracture of wall of acetabulum and head of femur with external fixation
27256,Closed reduction of dislocation of hip by abduction
27257,Closed reduction of dislocation of hip by abduction with manipulation under anesthesia
27258,Open reduction of dislocation of hip with replacement of femoral head in acetabulum
27259,Open reduction of dislocation of hip with replacement of femoral head in acetabulum and shortening of femoral shaft
27265,Closed reduction of dislocation of post arthroplasty hip joint
27266,Closed reduction of dislocation of post arthroplasty hip joint under anesthesia
27267,Closed reduction of fracture of head of femur
27268,Closed reduction of fracture of head of femur with manipulation
27269,Open reduction of fracture of head of femur
27275,Manipulation of hip joint under general anesthesia
27279,Arthrodesis of sacroiliac joint
27280,Arthrodesis of sacroiliac joint
27282,Arthrodesis of symphysis pubis
27284,Arthrodesis of hip joint
27286,Arthrodesis of hip joint with subtrochanteric osteotomy
27290,Hindquarter amputation
27295,Disarticulation of hip
27299,Procedure on hip joint
27301,Incision and drainage of bursa of knee region
27303,Deep incision with opening of bone cortex of femur
27305,Open iliotibial fasciotomy
27306,Percutaneous adductor tenotomy of hip
27307,Percutaneous adductor tenotomy of hip
27310,Arthrotomy of knee with drainage
27323,Biopsy of soft tissue of thigh
27324,Biopsy of soft tissue of thigh
27325,Neurectomy of hamstring muscle
27326,Neurectomy of gastrocnemius muscle
27327,Excision of tumor of soft tissue of thigh
27328,Excision of tumor of soft tissue of thigh
27329,Radical resection of tumor of soft tissue of thigh
27330,Arthrotomy of knee with synovial biopsy
27331,Arthrotomy of knee with biopsy
27332,Arthrotomy of knee with excision of lateral semilunar cartilage
27333,Arthrotomy of knee with excision of medial and lateral semilunar cartilage
27334,Arthrotomy of knee with anterior synovectomy
27335,Arthrotomy of knee with anterior and posterior synovectomy
27337,Excision of tumor of soft tissue of thigh
27339,Excision of tumor of soft tissue of knee
27340,Excision of prepatellar bursa
27345,Excision of synovial cyst of popliteal space
27347,Excision of lesion of capsule of knee joint
27350,Hemipatellectomy
27355,Curettage of benign tumor of femur
27356,Curettage of benign tumor of femur with allograft
27357,Curettage of benign tumor of femur with autograft
27358,Curettage of benign tumor of femur with internal fixation
27360,Partial excision of femur
27364,Radical resection of tumor of soft tissue of knee
27365,Radical resection of tumor of femur
27369,Injection of contrast for arthrography of knee
27372,Removal of foreign body of thigh
27380,Primary suture of infrapatellar tendon
27381,Secondary suture of infrapatellar tendon with fascial graft
27385,Primary suture of rupture of hamstring muscle
27386,Secondary suture of rupture of hamstring muscle with tendon graft
27390,Open tenotomy of tendon of hamstring muscle from knee to hip
27391,Open tenotomy of tendon of unilateral hamstring muscle from knee to hip
27392,Open tenotomy of tendon of bilateral hamstring muscle from knee to hip
27393,Lengthening of tendon of hamstring muscle
27394,Lengthening of tendon of unilateral hamstring muscle
27395,Lengthening of tendon of bilateral hamstring muscle
27396,Transfer of tendon of thigh
27397,Transfer of tendon of thigh
27400,Transfer of muscle from hamstring to femur
27403,Arthrotomy of knee with repair of meniscus
27405,Primary repair of torn capsule of knee
27407,Primary repair of torn capsule of knee
27409,Primary repair of torn capsule of knee
27412,Autologous chondrocyte implantation of knee joint
27415,Open grafting of osteochondral allograft to knee
27416,Open grafting of osteochondral autograft to knee
27418,Anterior tibial tubercleplasty
27420,Reconstruction for dislocation of patella
27422,Reconstruction for dislocating patella with extensor realignment
27424,Reconstruction for dislocating patella with patellectomy
27425,Open lateral retinacular release of knee
27427,Extra-articular ligamentous reconstruction of knee
27428,Open intra-articular ligamentous reconstruction of knee
27429,Open intra-articular and extra-articular ligamentous reconstruction of knee
27430,Quadricepsplasty
27435,Capsulotomy of knee with posterior capsular release
27437,Arthroplasty of patella
27438,Arthroplasty of patella with prosthesis
27440,Arthroplasty of tibial plateau
27441,Arthroplasty of tibial plateau with debridement and partial synovectomy
27442,Arthroplasty of femoral condyle
27443,Arthroplasty of femoral condyle with debridement and partial synovectomy
27445,Arthroplasty of knee with hinge prosthesis
27446,Arthroplasty of lateral femoral condyle and tibial plateau
27447,Arthroplasty of medial and lateral femoral condyle and tibial plateau
27448,Osteotomy of shaft of femur
27450,Osteotomy of shaft of femur with fixation
27454,Osteotomy of shaft of femur with realignment on intramedullary rod
27455,Osteotomy of proximal tibia with excision of fibula
27457,Osteotomy of proximal tibia with osteotomy of fibula
27465,Shortening of femur
27466,Osteoplasty of femur with lengthening
27468,"Combined osteoplasty of femur with lengthening, shortening and transfer of femoral segment"
27470,Repair of malunion of femur distal to head and neck
27472,Repair of malunion of femur distal to head and neck with autogenous bone graft
27475,Epiphyseal arrest of distal femur
27477,Epiphyseal arrest of proximal tibia and fibula
27479,"Epiphyseal arrest of distal femur, proximal tibia and fibula"
27485,Hemiepiphyseal arrest of distal femur
27486,Revision of total arthroplasty of knee
27487,Revision of femoral and entire tibial components of total arthroplasty of knee
27488,Removal of total knee prosthesis with methylmethacrylate
27495,Prophylactic treatment of femur
27496,Decompression fasciotomy of knee
27497,Decompression fasciotomy of knee with debridement of nonviable muscle
27498,Decompression fasciotomy of knee
27499,Decompression fasciotomy of knee with debridement of nonviable muscle
27500,Closed reduction of fracture of shaft of femoral shaft fracture
27501,Closed reduction of supracondylar fracture of femur
27502,Closed reduction of fracture of shaft of femur with manipulation
27503,Closed reduction of supracondylar fracture of femur with intercondylar extension and manipulation
27506,Open reduction of fracture of shaft of femur with external fixation and insertion of intramedullary implant
27507,Open reduction of fracture of shaft of femur with fixation using plate
27508,Closed reduction of fracture of distal lateral condyle of femur
27509,Percutaneous skeletal fixation of fracture of distal lateral condyle of femur
27510,Closed reduction of fracture of distal lateral condyle of femur with manipulation
27511,Open reduction of supracondylar fracture of femur
27513,Open reduction of supracondylar fracture of femur with intercondylar extension
27514,Open reduction of fracture of distal lateral condyle of femur
27516,Closed reduction of separated epiphysis of distal femur
27517,Closed reduction of separated epiphysis of distal femur with manipulation
27519,Open reduction of separated epiphysis of distal femur with internal fixation
27520,Closed reduction of fracture of patella
27524,Open reduction of fracture of patella with complete patellectomy and soft tissue repair
27530,Closed reduction of fracture of proximal tibia
27532,Closed reduction of fracture of proximal tibia with manipulation and skeletal traction
27535,Open reduction of unicondylar fracture of proximal tibia
27536,Open reduction of bicondylar fracture of proximal tibia
27538,Closed reduction of fracture of intercondylar spine and tuberosity of tibia
27540,Open reduction of fracture of intercondylar spine and tuberosity of tibia
27550,Closed reduction of dislocation of knee
27552,Closed reduction of dislocation of knee under anesthesia
27556,Open reduction of dislocation of knee
27557,Open reduction of dislocation of knee with primary ligamentous repair
27558,"Open reduction of dislocation of knee with internal fixation, primary ligamentous repair and augmentation"
27560,Closed reduction of dislocation of patella
27562,Closed reduction of dislocation of patella under anesthesia
27566,Open reduction of dislocation of knee
27570,Manipulation of knee joint under general anesthesia
27580,Arthrodesis of knee
27590,Amputation of thigh through femur
27591,Amputation of thigh through femur including immediate fitting technique and application of cast
27592,Open circular amputation of thigh through femur
27594,Revision of scar of amputation of thigh through femur
27596,Re-amputation of thigh through femur
27598,Disarticulation of knee
27599,Procedure on femur
27600,Decompression fasciotomy of anterior and lateral compartment of lower leg
27601,Decompression fasciotomy of posterior compartment of lower leg
27602,Decompression fasciotomy of anterior and posterior compartment of lower leg
27603,Incision and drainage of deep abscess of ankle
27604,Incision and drainage of infected bursa of ankle
27605,Percutaneous tenotomy of Achilles tendon under local anesthesia
27606,Percutaneous tenotomy of Achilles tendon under general anesthesia
27607,Incision of ankle
27610,Arthrotomy of ankle with drainage
27612,Arthrotomy of ankle with posterior capsular release
27613,Biopsy of soft tissue of ankle
27614,Biopsy of soft tissue of ankle
27615,Radical resection of tumor of soft tissue of ankle
27616,Radical resection of tumor of soft tissue of ankle
27618,Excision of tumor of soft tissue of ankle
27619,Excision of tumor of soft tissue of ankle
27620,Arthrotomy of ankle with joint exploration and biopsy
27625,Arthrotomy of ankle with synovectomy
27626,Arthrotomy of ankle with synovectomy and tenosynovectomy
27630,Excision of lesion of capsule of ankle
27632,"Excision of subcutaneous tumor of soft tissue of ankle area, 3 centimeters or greater"
27634,"Excision of intramuscular tumor of soft tissue of lower leg, 5 centimeters or greater"
27635,Curettage of benign tumor of fibula
27637,Curettage of benign tumor of fibula with autograft
27638,Curettage of benign tumor of fibula with allograft
27640,Partial excision of tibia
27641,Partial excision of fibula
27645,Radical resection of tumor of tibia
27646,Radical resection of tumor of fibula
27647,Radical resection of tumor of calcaneus
27648,Injection procedure for arthrography of ankle
27650,Primary open repair of ruptured Achilles tendon
27652,Primary open repair of ruptured Achilles tendon with graft
27654,Secondary repair of Achilles tendon
27656,Repair of defect of fascia of lower leg
27658,Primary repair of flexor tendon of lower leg
27659,Secondary repair of flexor tendon of lower leg
27664,Primary repair of extensor tendon of lower leg
27665,Secondary repair of extensor tendon of lower leg
27675,Repair of dislocating peroneal tendon
27676,Repair of dislocating peroneal tendon with fibular osteotomy
27680,Tenolysis of flexor tendon of ankle
27681,Tenolysis of extensor tendon of ankle
27685,Lengthening of tendon of ankle
27686,Lengthening of tendon of ankle
27687,Gastrocnemius recession
27690,Transfer of tendon of ankle
27691,Transfer of tendon of ankle
27692,Transfer of tendon of ankle
27695,Primary repair of rupture of collateral ligament of ankle
27696,Primary repair of rupture of both collateral ligaments of ankle
27698,Secondary repair of rupture of collateral ligament of ankle
27700,Arthroplasty of the ankle
27702,Arthroplasty of ankle with implant
27703,Revision of total replacement of ankle joint
27704,Removal of ankle implant
27705,Osteotomy of tibia
27707,Osteotomy of fibula
27709,Osteotomy of tibia and fibula
27712,Multiple osteotomies of tibia with realignment on intramedullary rod
27715,Lengthening of tibia and fibula
27720,Repair of malunion of tibia
27722,Repair of malunion of tibia with sliding graft
27724,Repair of malunion of tibia with autograft
27725,Repair of malunion of tibia
27726,Repair of malunion of fibula with internal fixation
27727,Repair of congenital pseudoarthrosis of tibia
27730,Open epiphyseal arrest of distal tibia by epiphysiodesis
27732,Open epiphyseal arrest of distal fibula by epiphysiodesis
27734,Open epiphyseal arrest of distal tibia and fibula by epiphysiodesis
27740,Open epiphyseal arrest of proximal and distal tibia and fibula by epiphysiodesis
27742,Open epiphyseal arrest of distal femur and proximal and distal tibia and fibula by epiphysiodesis
27745,Prophylactic treatment of tibia
27750,Closed reduction of fracture of shaft of tibia
27752,Closed reduction of fracture of shaft of tibia with manipulation
27756,Percutaneous skeletal fixation of fracture of shaft of tibia
27758,Open reduction of fracture of shaft of tibia with fixation using plate with cerclage
27759,Open reduction of fracture of shaft of tibia with fixation using intramedullary implant
27760,Closed reduction of fracture of medial malleolus
27762,Closed reduction of fracture of medial malleolus with manipulation
27766,Open reduction of fracture of medial malleolus
27767,Closed reduction of fracture of posterior malleolus
27768,Closed reduction of fracture of posterior malleolus with manipulation
27769,Open reduction of fracture of posterior malleolus
27780,Closed reduction of fracture of proximal fibula
27781,Closed reduction of fracture of proximal fibula with manipulation
27784,Open reduction of fracture of proximal fibula
27786,Closed reduction of fracture of distal fibula
27788,Closed reduction of fracture of distal fibula with manipulation
27792,Open reduction of fracture of distal fibula
27808,Closed reduction of bimalleolar fracture of ankle
27810,Closed reduction of bimalleolar fracture of ankle with manipulation
27814,Open reduction of bimalleolar fracture of ankle with internal fixation
27816,Closed reduction of trimalleolar fracture of ankle
27818,Closed reduction of trimalleolar fracture of ankle with manipulation
27822,Open reduction of trimalleolar fracture of ankle with internal fixation
27823,Open reduction of trimalleolar fracture of ankle with internal fixation and fixation of posterior lip of tibia
27824,Closed reduction of fracture of distal tibia
27825,Closed reduction of fracture of distal tibia under anesthesia with manipulation
27826,Open reduction of fracture of pilon of tibia with internal fixation of fibula
27827,Open reduction of fracture of distal tibia
27828,Open reduction of fracture of distal tibia with internal fixation of tibia and fibula
27829,Open reduction of dislocation of distal tibiofibular joint
27830,Closed reduction of proximal tibiofibular joint dislocation
27831,Closed reduction of proximal tibiofibular joint dislocation under anesthesia
27832,Open reduction of proximal tibiofibular joint dislocation with excision of proximal fibula
27840,Closed reduction of dislocation of ankle
27842,Closed reduction of dislocation of ankle under anesthesia
27846,Open reduction of dislocation of ankle
27848,"Open reduction of dislocation of ankle with percutaneous skeletal fixation, repair and external fixation"
27860,Manipulation of ankle under general anesthesia
27870,Open arthrodesis of ankle
27871,Arthrodesis of distal tibiofibular joint
27880,Amputation of lower leg through tibia and fibula
27881,Amputation of lower leg through tibia and fibula with immediate fitting technique and application of cast
27882,Open circular amputation of lower leg through tibia and fibula
27884,Revison of scar of amputation of lower leg through tibia and fibula
27886,Reamputation of lower leg through tibia and fibula
27888,Disarticulation of ankle through malleoli of tibia and fibula with plastic closure and resection of nerve
27889,Disarticulation of ankle
27892,Decompression fasciotomy of anterior and lateral compartments of lower leg with debridement of nerve
27893,Decompression fasciotomy of posterior compartment of lower leg with debridement of nerve
27894,Decompression fasciotomy of anterior and posterior compartment of lower leg with debridement of nerve
27899,Procedure on ankle
28001,Incision and drainage of bursa of foot
28002,Incision and drainage of bursal space of foot
28003,Incision and drainage of foot
28005,Incision of cortex of bone of foot
28008,Fasciotomy of foot
28010,Percutaneous tenotomy of tendon of toe
28011,Percutaneous tenotomy of tendon of toe
28020,Arthrotomy with drainage of intertarsal joint
28022,Arthrotomy with drainage of metatarsophalangeal joint
28024,Arthrotomy with drainage of interphalangeal joint
28035,Release of tarsal tunnel
28039,Excision of tumor of soft tissue of foot
28041,Excision of tumor of soft tissue of foot
28043,Excision of tumor of soft tissue of foot
28045,Excision of tumor of soft tissue of foot
28046,Radical resection of tumor of soft tissue of foot
28047,Radical resection of tumor of soft tissue of foot
28050,Arthrotomy of intertarsal joint with biopsy
28052,Arthrotomy of metatarsophalangeal joint with biopsy
28054,Arthrotomy of interphalangeal joint with biopsy
28055,Neurectomy of intrinsic muscle of foot
28060,Partial fasciectomy of plantar fascia
28062,Radical fasciectomy of plantar fascia
28070,Synovectomy of intertarsal joint
28072,Synovectomy of metatarsophalangeal joint
28080,Excision of Morton neuroma
28086,Synovectomy of flexor tendon sheath of foot
28088,Synovectomy of extensor tendon sheath of foot
28090,Excision of lesion of capsule of foot
28092,Excision of lesion of capsule of toes
28100,Curettage of benign tumor of calcaneus
28102,Curettage of benign tumor of calcaneus with autograft
28103,Curettage of benign tumor of calcaneus with allograft
28104,Curettage of benign tumor of metatarsal bone
28106,Excision of cyst of metatarsal with iliac autograft
28107,Curettage of benign tumor of metatarsal bone with allograft
28108,Curettage of benign tumor of phalanx of foot
28110,Partial excision of head of fifth metatarsal bone
28111,Complete excision of head of first metatarsal bone
28112,Complete excision of head of fourth metatarsal bone
28113,Complete excision of head of fifth metatarsal bone
28114,Complete excision of head of metatarsal with partial proximal phalangectomy
28116,Excision of tarsal coalition
28118,Ostectomy of calcaneus
28119,Ostectomy of calcaneus for spur
28120,Partial excision of calcaneus
28122,Craterization of metatarsal bone
28124,Partial excision of phalanx of toe
28126,Complete resection of phalangeal base of toe
28130,Talectomy
28140,Metatarsectomy
28150,Phalangectomy of toe
28153,Resection of condyle of distal end of phalanx of toe
28160,Excision of proximal part of phalanx of toe
28171,Radical resection of tumor of tarsal bone
28173,Radical resection of tumor of metatarsal bone
28175,Radical resection of tumor of phalanx of toe
28190,Removal of foreign body from foot
28192,Removal of foreign body from foot
28193,Removal of foreign body from foot
28200,Repair of flexor tendon of foot
28202,Repair of flexor tendon of foot with free graft
28208,Repair of extensor tendon of foot
28210,Repair of extensor tendon of foot with free graft
28220,Tenolysis of flexor tendon of foot
28222,Tenolysis of flexor tendon of foot
28225,Tenolysis of extensor tendon of foot
28226,Tenolysis of extensor tendon of foot
28230,Open tenotomy of flexor tendon of foot
28232,Open tenotomy of flexor tendon of toe
28234,Open tenotomy of extensor tendon of foot
28238,Advancement of posterior tibial tendon with excision of accessory tarsal navicular bone
28240,Tenotomy of abductor hallucis muscle with lengthening
28250,Division of plantar fascia and muscle
28260,Capsulotomy of midfoot with medial release
28261,Capsulotomy of midfoot with tendon lengthening
28262,Capsulotomy of midfoot with posterior talotibial capsulotomy and lengthening of tendon
28264,Capsulotomy of midtarsal joint
28270,Capsulotomy of metatarsophalangeal joint
