CPT Code,Description
44373,Small intestinal endoscopy with conversion of percutaneous gastrostomy tube to percutaneous jejunostomy tube
44376,Diagnostic small intestinal endoscopy
44377,Small intestinal endoscopy with biopsy
44378,Small intestinal endoscopy with control of bleeding
44379,Small intestinal endoscopy with predilation and transendoscopic stent placement
44380,Diagnostic ileoscopy through stoma
44381,Ileoscopy through stoma with transendoscopic balloon dilation
44382,Ileoscopy through stoma with biopsy
44384,Ileoscopy through stoma with transendoscopic stent placement
44385,Diagnostic endoscopic evaluation of small intestinal abdominal pouch
44386,Endoscopic evaluation of small intestinal abdominal pouch with biopsy
44388,Diagnostic colonoscopy through stoma
44389,Colonoscopy through stoma with biopsy
44390,Colonoscopy through stoma with removal of foreign body
44391,Colonoscopy through stoma with control of bleeding
44392,Colonoscopy through stoma with removal of lesion using bipolar cautery
44394,Colonoscopy through stoma with removal of lesion using snare
44401,Colonoscopy through stoma with ablation of lesion
44402,Colonoscopy through stoma with insertion of stent
44403,Colonoscopy through stoma with resection of mucosa
44404,Colonoscopy through stoma with submucosal injection
44405,Colonoscopy through stoma with transendoscopic dilation using balloon
44406,Colonoscopy through stoma with ultrasound imaging
44407,Colonoscopy through stoma with transendoscopic intramural fine needle aspiration using ultrasound guidance
44408,Colonoscopy through stoma with decompression
44500,Introduction of long gastrointestinal tube
4450F,Self-care education provided to patient (HF)
44602,Suture of perforation of small intestine
44603,Suture of perforation of small intestine
44604,Suture of perforation of large intestine
44605,Suture of large intestine with colostomy
44615,Intestinal stricturoplasty
44620,Closure of enterostomy of large intestine
44625,Closure of enterostomy of large intestine with resection and anastomosis
44626,Closure of enterostomy of large intestine with resection and colorectal anastomosis
44640,Closure of intestinal cutaneous fistula
44650,Closure of enterocolic fistula
44660,Closure of enterovesical fistula
44661,Closure of enterovesical fistula with bladder resection
44680,Intestinal plication
44700,Exclusion of small intestine from pelvis using mesh
44701,Intraoperative colonic lavage
44705,preparation of fecal microbiota for instillation
4470F,Implantable cardioverter-defibrillator (ICD) counseling provided (HF)
44715,Backbench standard preparation of cadaver donor intestine allograft for transplantation
44720,Backbench venous anastomosis of cadaver donor intestine allograft for transplantation
44721,Backbench arterial anastomosis of cadaver donor intestine allograft for transplantation
44799,Procedure on small intestine
44800,Excision of Meckel's diverticulum
4480F,Patient receiving ACE inhibitor/ARB therapy and beta-blocker therapy for 3 months or longer (HF)
4481F,Patient receiving ACE inhibitor/ARB therapy and beta-blocker therapy for less than 3 months or patient not receiving ACE inhibitor/ARB therapy and beta-blocker therapy (HF)
44820,Excision of lesion of mesentery
44850,Suture of mesentery
44899,Procedure on Meckel's diverticulum and mesentery
44900,Open incision and drainage of appendiceal abscess
44950,Appendectomy
44955,Appendectomy
44960,Appendectomy of ruptured appendix with abscess
44970,Surgical laparoscopy with appendectomy
44979,Laparoscopy procedure on appendix
45000,Drainage of pelvic abscess by transrectal approach
45005,Incision and drainage of submucosal abscess of rectum
4500F,Referred to an outpatient cardiac rehabilitation program (CAD)
45020,Incision and drainage of pelvirectal abscess
45100,Biopsy of anorectal wall by anal approach
45108,Anorectal myomectomy
4510F,Previous cardiac rehabilitation for qualifying cardiac event completed (CAD)
45110,Complete combined abdominoperineal proctectomy with colostomy
45111,Partial resection of rectum by transabdominal approach
45112,Complete proctectomy with pull-through procedure by combined abdominoperineal approach
45113,"Partial proctectomy with rectal mucosectomy, ileoanal anastomosis, and creation of S ileal reservoir"
45114,Partial proctectomy with anastomosis by abdominal and transsacral approach
45116,Partial proctectomy with anastomosis by transsacral approach
45119,Proctectomy with combined abdominoperineal pull-through procedure and creation of colonic reservoir
45120,Complete proctectomy with pull-through procedure and anastomosis by abdominal and perineal approach
45121,Complete proctectomy with complete colectomy and biopsy by abdominal and perineal approach
45123,Partial proctectomy by perineal approach
45126,Pelvic exenteration for colorectal malignancy
45130,Excision of rectal procidentia with anastomosis by perineal approach
45135,Excision of rectal procidentia with anastomosis by abdominal and perineal approach
45136,Excision of ileoanal reservoir with ileostomy
45150,Division of stricture of rectum
45160,Proctotomy and excision of rectal tumor by transcoccygeal approach
45171,Partial thickness excision of rectal tumor by transanal approach
45172,Full thickness excision of rectal tumor by transanal approach
45190,Destruction of rectal tumor by transanal approach
4525F,Neuropsychiatric intervention ordered (DEM)
4526F,Neuropsychiatric intervention received (DEM)
45300,Diagnostic rigid proctosigmoidoscopy
45303,Rigid proctosigmoidoscopy with dilation
45305,Rigid proctosigmoidoscopy with biopsy
45307,Rigid proctosigmoidoscopy with removal of foreign body
45308,Rigid proctosigmoidoscopy with removal of lesion using bipolar cautery
45309,Rigid proctosigmoidoscopy with removal of lesion using snare
45315,Rigid proctosigmoidoscopy with removal of lesion using bipolar cautery
45317,Rigid proctosigmoidoscopy with control of bleeding
45320,Rigid proctosigmoidoscopy with ablation of lesion
45321,Rigid proctosigmoidoscopy with decompression of volvulus
45327,Rigid proctosigmoidoscopy with predilation and transendoscopic stent placement
45330,Diagnostic flexible sigmoidoscopy
45331,Flexible sigmoidoscopy with biopsy
45332,Flexible sigmoidoscopy with removal of foreign body
45333,Flexible sigmoidoscopy with removal of lesion using bipolar cautery
45334,Flexible sigmoidoscopy with control of bleeding
45335,Flexible sigmoidoscopy with directed submucosal injection
45337,Flexible sigmoidoscopy with decompression of volvulus
45338,Flexible sigmoidoscopy with removal of lesion using snare
45340,Flexible sigmoidoscopy with dilation using balloon
45341,Flexible sigmoidoscopy with endoscopic ultrasound examination
45342,Flexible sigmoidoscopy with transendoscopic intramural fine needle aspiration using ultrasound guidance
45346,Flexible sigmoidoscopy with ablation of lesion
45347,Flexible sigmoidoscopy with transendoscopic stent placement
45349,Flexible sigmoidoscopy with transendoscopic mucosal resection
45350,Flexible sigmoidoscopy with band ligation
45378,Diagnostic flexible colonoscopy proximal to splenic flexure
45379,Flexible colonoscopy proximal to splenic flexure with removal of foreign body
45380,Flexible colonoscopy proximal to splenic flexure with biopsy
45381,Flexible colonoscopy proximal to splenic flexure with directed submucosal injection
45382,Flexible colonoscopy proximal to splenic flexure with control of bleeding
45384,Flexible colonoscopy proximal to splenic flexure with removal of lesion using hot biopsy forceps
45385,Flexible colonoscopy proximal to splenic flexure with removal of lesion using snare
45386,Flexible colonoscopy proximal to splenic flexure with dilation of stricture using balloon
45388,Flexible colonoscopy with ablation of lesion
45389,Flexible colonoscopy with insertion of stent
45390,Flexible colonoscopy with resection of mucosa
45391,Flexible colonoscopy proximal to splenic flexure with endoscopic ultrasound examination
45392,Flexible colonoscopy proximal to splenic flexure with transendoscopic intramural fine needle aspiration using ultrasound guidance
45393,Flexible colonoscopy with decompression
45395,Surgical laparoscopy with complete abdominoperineal proctectomy and colostomy
45397,Surgical laparoscopy with combined abdominoperineal pull-through proctectomy and creation of colonic reservoir
45398,Flexible colonoscopy with band ligation
45399,Procedure on colon
45400,Surgical laparoscopy with proctopexy
45402,Surgical laparoscopy with proctopexy and sigmoid resection
4540F,Disease modifying pharmacotherapy discussed (ALS)
4541F,"Patient offered treatment for pseudobulbar affect, sialorrhea, or ALS-related symptoms (ALS)"
45499,Laparoscopy procedure on rectum
45500,Proctoplasty of stenosis
45505,Proctoplasty of prolapse of mucous membrane
4550F,Options for noninvasive respiratory support discussed with patient (ALS)
4551F,Nutritional support offered (ALS)
45520,Perirectal injection of sclerosing solution
4552F,Patient offered referral to a speech language pathologist (ALS)
4553F,Patient offered assistance in planning for end of life issues (ALS)
45540,Proctopexy by abdominal approach
45541,Proctopexy by perineal approach
4554F,Patient received inhalational anesthetic agent (Peri2)
45550,Proctopexy with sigmoid resection by abdominal approach
4555F,Patient did not receive inhalational anesthetic agent (Peri2)
45560,Repair of rectocele
45562,"Exploration, repair, and presacral drainage of rectal injury"
45563,"Exploration, repair, and presacral drainage of rectal injury with colostomy"
4556F,Patient exhibits 3 or more risk factors for post-operative nausea and vomiting (Peri2)
4557F,Patient does not exhibit 3 or more risk factors for post-operative nausea and vomiting (Peri2)
4558F,Patient received at least 2 prophylactic pharmacologic anti-emetic agents of different classes preoperatively and intraoperatively (Peri2)
4559F,At least 1 body temperature measurement equal to or greater than 35.5 degrees Celsius (or 95.9 degrees Fahrenheit) recorded within the 30 minutes immediately before or the 15 minutes immediately after anesthesia end time (Peri2)
4560F,Anesthesia technique did not involve general or neuraxial anesthesia (Peri2)
4561F,Patient has a coronary artery stent (Peri2)
4562F,Patient does not have a coronary artery stent (Peri2)
4563F,Patient received aspirin within 24 hours prior to anesthesia start time (Peri2)
45800,Closure of rectovesical fistula
45805,Closure of rectovesical fistula with colostomy
45820,Closure of rectourethral fistula
45825,Closure of rectourethral fistula with colostomy
45900,Reduction of procidentia under anesthesia
45905,Dilation of anal sphincter under anesthesia
45910,Dilation of rectal stricture under anesthesia
45915,Removal of fecal impaction under anesthesia
45990,Diagnostic surgical anorectal exam under anesthesia
45999,Procedure on rectum
46020,Placement of seton
46030,Removal of anal marker
46040,Incision and drainage of ischiorectal abscess
46045,"Incision and drainage of intramural perirectal abscess, by transanal approach under anesthesia"
46050,Incision and drainage of superficial perianal abscess
46060,Incision and drainage of intramural perirectal abscess with submuscular fistulectomy
46070,Incision of anal septum
46080,Division of anal sphincter
46083,Incision of thrombosed external hemorrhoid
46200,Fissurectomy
46220,Excision of external papilla of anus
46221,Internal hemorrhoidectomy by ligation using rubber band
46230,Excision of external papilla of anus
46250,External hemorrhoidectomy
46255,Internal and external hemorrhoidectomy
46257,Internal and external hemorrhoidectomy with fissurectomy
46258,Internal and external hemorrhoidectomy with fistulectomy
46260,Internal and external hemorrhoidectomy
46261,Internal and external hemorrhoidectomy with fissurectomy
46262,Internal and external hemorrhoidectomy with fistulectomy
46270,Surgical treatment of subcutaneous anal fistula
46275,Surgical treatment of intersphincteric anal fistula
46280,Surgical treatment of extrasphincteric anal fistula
46285,Second stage of surgical treatment of anal fistula
46288,Closure of anal fistula with rectal advancement flap
46320,Excision of thrombosed external hemorrhoid
46500,Injection of sclerosing solution into hemorrhoid
46505,Chemodenervation of internal anal sphincter
46600,Diagnostic anoscopy
46601,Diagnostic anoscopy with collection of specimen
46604,Anoscopy with dilation
46606,Anoscopy with biopsy
46607,Diagnostic anoscopy with biopsy
46608,Anoscopy with removal of foreign body
46610,Anoscopy with removal of lesion using bipolar cautery
46611,Anoscopy with removal of lesion using snare
46612,Anoscopy with removal of lesion using bipolar cautery
46614,Anoscopy with control of bleeding
46615,Anoscopy with ablation of lesion
46700,Anoplasty of stricture of anus
46705,Anoplasty of stricture of anus
46706,Repair of anal fistula with fibrin glue
46707,Repair of anorectal fistula using plug
46710,Repair of ileoanal pouch fistula with pouch advancement by transperineal approach
46712,Repair of ileoanal pouch fistula with pouch advancement by combined transperineal and transabdominal approach
46715,Repair of low imperforate anus with anoperineal fistula
46716,Repair of low imperforate anus with transposition of anoperineal fistula
46730,Repair of high imperforate anus by perineal approach
46735,Repair of high imperforate anus by combined transabdominal and sacroperineal approaches
46740,Repair of high imperforate anus with rectourethral fistula by perineal approach
46742,Repair of high imperforate anus with rectourethral fistula by combined transabdominal and sacroperineal approaches
46744,Repair of cloacal anomaly by anorectovaginoplasty and urethroplasty by sacroperineal approach
46746,Repair of cloacal anomaly by anorectovaginoplasty and urethroplasty by combined abdominal and sacroperineal approach
46748,Repair of cloacal anomaly by anorectovaginoplasty and urethroplasty by combined abdominal and sacroperineal approach with vaginal lengthening by intestinal graft
46750,Anal sphincteroplasty
46751,Anal sphincteroplasty
46753,Graft for rectal incontinence
46754,Removal of Thiersch wire from anal canal
46760,Anal sphincteroplasty with muscle transplant
46761,Anal sphincteroplasty with levator muscle imbrication
46900,Chemical destruction of lesion of anus
46910,Electrodesiccation of lesion of anus
46916,Cryosurgical destruction of lesion of anus
46917,Laser surgical destruction of lesion of anus
46922,Surgical excision of lesion of anus
46924,Destruction of lesion of anus
46930,Destruction of internal hemorrhoid using thermal energy
46940,Cautery of anal fissure
46942,Cautery of anal fissure
46945,Internal hemorrhoidectomy by ligation of single column
46946,Internal hemorrhoidectomy by ligation of multiple columns
46947,Hemorrhoidopexy using staples
46948,Internal hemorrhoidectomy by transanal dearterialization of multiple hemorrhoid columns using ultrasound guidance
46999,Procedure on anus
47000,Percutaneous needle biopsy of liver
47001,Needle biopsy of liver
47010,Hepatotomy for open drainage of abscess
47015,Laparotomy with aspiration and injection of hepatic parasitic abscess
47100,Wedge biopsy of liver
47120,Partial lobectomy of liver
47122,Trisegmentectomy of liver
47125,Complete left lobectomy of liver
47130,Complete right lobectomy of liver
47133,Hepatectomy from cadaver donor
47135,Complete orthotopic liver allotransplantation from cadaver donor
47140,Hepatectomy of left lateral segment of liver from living donor
47141,Complete left lobectomy of liver from living donor
47142,Complete right lobectomy of liver from living donor
47143,Backbench standard preparation of cadaver donor liver allograft for transplantation
47144,Backbench standard preparation of cadaver donor liver allograft for transplantation
47145,Backbench standard preparation of cadaver donor liver allograft for transplantation
47146,Backbench venous anastomosis of cadaver liver graft for allotransplantation
47147,Backbench arterial anastomosis of cadaver liver graft for allotransplantation
47300,Marsupialization of abscess of liver
47350,Suture of liver injury
47360,Suture of liver injury
47361,Exploration of hepatic wound with coagulation
47362,Re-exploration of hepatic wound for removal of packing
47370,Surgical laparoscopy with radiofrequency ablation of liver tumor
47371,Surgical laparoscopy with cryosurgical ablation of liver tumor
47379,Laparoscopic procedure on liver
47380,Open radiofrequency ablation of liver tumor
47381,Open cryosurgical ablation of liver tumor
47382,Percutaneous radiofrequency ablation of liver tumor
47383,Percutaneous cryoablation of tumor of liver with imaging guidance
47399,Procedure on liver
47400,Hepaticostomy with drainage
47420,Choledochostomy and cholecystotomy with drainage
47425,Choledochostomy with drainage and transduodenal sphincterotomy
47460,Transduodenal sphincteroplasty
47480,Open cholecystostomy with drainage
47490,Percutaneous cholecystostomy using imaging guidance
47531,Injection procedure for cholangiography using imaging guidance
47532,Injection procedure for cholangiography using imaging guidance
47533,Percutaneous insertion of external biliary drainage catheter using imaging guidance
47534,Percutaneous insertion of internal-external biliary drainage catheter using imaging guidance
47535,Percutaneous conversion of external biliary drainage catheter to internal-external biliary drainage catheter with cholangiography using imaging guidance
47536,Percutaneous replacement of external biliary drainage catheter to internal-external biliary drainage catheter with cholangiography using imaging guidance
47537,Percutaneous removal of biliary drainage catheter using imaging guidance
47538,Percutaneous insertion of bile duct stent
47539,Percutaneous insertion of bile duct stent
47540,"Percutaneous insertion of bile duct stent and balloon dilation via new access and insertion of biliary drainage tube, using imaging guidance, with diagnostic cholangiography"
47541,Percutaneous insertion of access device of biliary tree and small bowel with cholangiogram using imaging guidance
47542,Percutaneous balloon dilatation of ampulla of Vater using imaging guidance with radiological supervision and interpretation
47543,Percutaneous endoluminal biopsy of biliary tree using imaging guidance
47544,Percutaneous removal of calculi and debris from biliary duct and gallbladder including destruction of calculi using imaging guidance
47550,Intraoperative biliary endoscopy
47552,Diagnostic percutaneous biliary endoscopy via T-tube
47553,Percutaneous biliary endoscopy via T-tube with biopsy
47554,Percutaneous biliary endoscopy via T-tube with removal of calculus
47555,Percutaneous biliary endoscopy via T-tube with dilation of biliary duct stricture
47556,Percutaneous biliary endoscopy via T-tube with dilation of biliary duct stricture using stent
47562,Surgical laparoscopy with cholecystectomy
47563,Surgical laparoscopy with cholecystectomy and cholangiography
47564,Surgical laparoscopy with cholecystectomy and exploration of common duct
47570,Surgical laparoscopy with cholecystoenterostomy
47579,Laparoscopy procedure on biliary tract
47600,Cholecystectomy
47605,Cholecystectomy with cholangiography
47610,Cholecystectomy with exploration of common duct
47612,Cholecystectomy with exploration of common duct and choledochoenterostomy
47620,Cholecystectomy with exploration of common duct and transduodenal sphincteroplasty
47700,Exploration for congenital atresia of bile duct
47701,Portoenterostomy
47711,Excision of extrahepatic bile duct tumor
47712,Excision of intrahepatic bile duct tumor
47715,Excision of choledochal cyst
47720,Direct cholecystoenterostomy
47721,Cholecystoenterostomy with gastroenterostomy
47740,Roux-en-Y cholecystoenterostomy
47741,Roux-en-Y cholecystoenterostomy with gastroenterostomy
47760,Anastomosis of extrahepatic biliary duct and gastrointestinal tract
47765,Anastomosis of intrahepatic biliary duct and gastrointestinal tract
47780,Roux-en-Y anastomosis of extrahepatic biliary duct and gastrointestinal tract
47785,Roux-en-Y anastomosis of intrahepatic biliary duct and gastrointestinal tract
47800,Plastic reconstruction of extrahepatic biliary duct with end-to-end anastomosis
47801,Placement of choledochal stent
47802,U-tube hepaticoenterostomy
47900,Suture of injury of extrahepatic biliary duct
47999,Procedure on biliary tract
48000,Placement of peripancreatic drain
48001,"Placement of peripancreatic drain with cholecystostomy, gastrostomy, and jejunostomy"
48020,Removal of pancreatic calculus
48100,Open biopsy of pancreas
48102,Percutaneous needle biopsy of pancreas
48105,Debridement of pancreas and peripancreatic tissue
48120,Excision of lesion of pancreas
48140,Distal subtotal pancreatectomy
48145,Distal subtotal pancreatectomy with pancreaticojejunostomy
48146,Distal near-total pancreatectomy with preservation of duodenum
48148,Excision of ampulla of Vater
48150,"Proximal subtotal pancreatectomy with total duodenectomy, partial gastrectomy, choledochoenterostomy, gastrojejunostomy and pancreatojejunostomy"
48152,"Proximal subtotal pancreatectomy with total duodenectomy, partial gastrectomy, choledochoenterostomy and gastrojejunostomy"
48153,"Proximal subtotal pancreatectomy with near-total duodenectomy, choledochoenterostomy, duodenojejunostomy and pancreatojejunostomy"
48154,"Proximal subtotal pancreatectomy with near-total duodenectomy, choledochoenterostomy and duodenojejunostomy"
48155,Complete pancreatectomy
48160,Complete pancreatectomy with autologous transplantation of pancreas
48400,Injection procedure for intraoperative pancreatography
48500,Marsupialization of pancreatic cyst
48510,Open external drainage of pseudocyst of pancreas
48520,Direct internal anastomosis of pancreatic cyst to gastrointestinal tract
48540,Roux-en-Y internal anastomosis of pancreatic cyst to gastrointestinal tract
48545,Suture of injury of pancreas
48547,Duodenal exclusion with gastrojejunostomy
48548,Side-to-side pancreaticojejunostomy
48550,Donor pancreatectomy
48551,Backbench standard preparation of cadaver pancreas allograft for transplantation
48552,Backbench venous anastomosis of cadaver donor pancreas allograft
48554,Transplantation of pancreatic allograft
48556,Removal of transplanted pancreatic allograft
48999,Procedure on pancreas
49000,Exploratory celiotomy
49002,Reopening of recent laparotomy
49010,Exploration of retroperitoneal area
49013,"Preperitoneal pelvic packing for hemorrhage associated with pelvic trauma, with local exploration"
49014,Re-exploration of pelvic wound with removal of preperitoneal pelvic packing
49020,Open drainage of localized peritonitis
49040,Open drainage of subdiaphragmatic abscess
49060,Open drainage of retroperitoneal abscess
49062,Open drainage of extraperitoneal lymphocele to peritoneal cavity
49082,Diagnostic abdominal paracentesis
49083,Diagnostic abdominal paracentesis using imaging guidance
49084,Peritoneal lavage
49180,Percutaneous needle biopsy of abdominal mass
49185,Percutaneous sclerotherapy of fluid collection cavity using imaging guidance with contrast injection
49203,Open destruction of primary mesenteric tumor
49204,Open destruction of primary mesenteric tumor
49205,Open destruction of primary mesenteric tumor
49215,Excision of presacral tumor
49220,Staging laparotomy for Hodgkins disease with splenectomy
49250,Excision of umbilicus
49255,Epiploectomy
49320,"Diagnostic laparoscopy of abdomen, peritoneum, and omentum"
49321,Surgical laparoscopy with biopsy
49322,Surgical laparoscopy with aspiration of cavity
49323,Surgical laparoscopy with drainage of lymphocele to peritoneal cavity
49324,Surgical laparoscopy with insertion of tunneled intraperitoneal catheter
49325,Surgical laparoscopy with revision of intraperitoneal cannula
49326,Surgical laparoscopy with omental tacking procedure
49327,Surgical laparoscopy with intra-abdominal and intra-pelvic placement of interstitial device for radiation therapy guidance
49329,"Laparoscopy procedure on abdomen, peritoneum and omentum"
49400,Injection of air or contrast into peritoneal cavity
49402,Removal of peritoneal foreign body from peritoneal cavity
49405,Percutaneous drainage of fluid of viscera with catheter
49406,Percutaneous drainage of peritoneal fluid with catheter
49407,Transrectal drainage of peritoneal fluid with catheter
49411,Intra-abdominal placement of interstitial device for radiation therapy guidance
49412,Open intra-abdominal and intrapelvic placement of interstitial device for radiation therapy guidance
49418,Percutaneous insertion of tunneled intraperitoneal catheter using imaging guidance
49419,Insertion of tunneled intraperitoneal catheter with subcutaneous port
49421,Open insertion of tunneled intraperitoneal catheter for dialysis
49422,Removal of tunneled intraperitoneal catheter
49423,Removal and replacement of abscess drainage catheter using radiologic guidance
49424,Contrast injection for assessment cyst via previously placed drainage catheter
49425,Insertion of peritoneal-venous shunt
49426,Revision of peritoneal-venous shunt
49427,Injection procedure for evaluation of previously placed peritoneal-venous shunt
49428,Ligation of peritoneal-venous shunt
49429,Removal of peritoneal-venous shunt
49435,Insertion of subcutaneous extension to intraperitoneal cannula with remote chest exit site
49436,Delayed creation of exit site from embedded subcutaneous segment of intraperitoneal cannula
