CPT Code,Description
81000,Manual urinalysis using dip stick and microscopy of urine
81001,Automated urinalysis using dip stick and microscopy of urine
81002,Manual urinalysis using dip stick
81003,Automated urinalysis using dip stick
81005,Qualitative urinalysis
81007,Screen for bacteriuria
81015,Microscopy of urine
81020,Three-glass test of urine
81025,Urine pregnancy test using visual color comparison method
81050,Volume measurement for timed collection of urine
81099,Urinalysis procedure
81105,"Human Platelet Antigen 1 genotyping (HPA-1), integrin, beta 3 [platelet glycoprotein IIIa], antigen CD61 [GPIIIa] (ITGB3) gene analysis for detection of HPA-1a/b (L33P) variant"
81106,"Human Platelet Antigen 2 genotyping (HPA-2), glycoprotein Ib [platelet], alpha polypeptide [GPIba] gene analysis for detection of HPA-2a/b (T145M) variant"
81107,"Human Platelet Antigen 3 genotyping (HPA-3), integrin, alpha 2b [platelet glycoprotein IIb of IIb/IIIa complex] (ITGA2B), antigen CD41 [GPIIb]) gene analysis for detection of HPA-3a/b (I843S) variant"
81108,"Human Platelet Antigen 4 genotyping (HPA-4), integrin, beta 3 [platelet glycoprotein IIb of IIb/IIIa complex], antigen CD41 [GPIIb]) (ITGB3) gene analysis for detection of HPA-4a/b (R143Q) variant"
81109,"Human Platelet Antigen 5 genotyping (HPA-5), integrin, alpha 2 [CD49B, alpha 2 subunit of VLA-2 receptor] [GPIa]) (ITGA2 ) gene analysis for detection of common variant"
81110,"Human Platelet Antigen 6 (HPA-6w) genotyping, integrin, beta 3 [platelet glycoprotein IIIa, antigen CD61] [GPIIIa]) (ITGB3) gene analysis for detection of HPA-6a/b (R489Q) variant"
81111,"Human Platelet Antigen 9 (HPA-9w) genotyping, integrin, alpha 2b [platelet glycoprotein IIb of IIb/IIIa complex, antigen CD41] [GPIIb] (ITGA2B) gene analysis for detection of HPA-9a/b (V837M) variant"
81112,"Human Platelet Antigen 15 (HPA-15) genotyping, CD109 molecule (CD109) gene analysis for detection of HPA-15a/b (S682Y) variants"
81120,"Isocitrate dehydrogenase 1 [NADP+], soluble (IDH1) gene analysis for common variant"
81121,"Isocitrate dehydrogenase 2 [NADP+], mitochondrial (IDH2) gene analysis for detection of R140W variant"
81161,DMD (dystrophin) deletion analysis
81162,"Breast cancer 1 and 2 (BRCA1, BRCA2) full sequence gene analysis and full analysis of duplication and deletion variants"
81163,"Breast cancer 1 and 2 (BRCA1, BRCA2) full sequence gene analysis"
81164,"Breast cancer 1 and 2 (BRCA1, BRCA2) full analysis of duplication and deletion variants"
81165,Breast cancer 1 (BRCA1) full sequence gene analysis
81166,Breast cancer 1 (BRCA1) full analysis of duplication and deletion variants
81167,Breast cancer 2 (BRCA2) full analysis of duplication and deletion variants
81168,CCND1/IGH (t(11;14)) qualitative and quantitative gene analysis for detection of translocation of major breakpoint
81170,"ABL proto-oncogene 1, non-receptor tyrosine kinase (ABL1) gene analysis for detection of variants in the kinase domain"
81171,"AF4/FMR2 family, member 2 [FMR2]) (AFF2) gene analysis for detection of abnormal alleles"
81172,"AF4/FMR2 family, member 2 [FMR2]) (AFF2) gene analysis for characterization of alleles"
81173,Androgen receptor (AR) full gene sequence analysis
81174,Androgen receptor (AR) gene analysis for detection of known familial variant
81175,"Additional sex combs like 1, transcriptional regulator (ASXL1) full gene sequence analysis"
81176,"Additional sex combs like 1, transcriptional regulator (ASXL1) targeted sequence analysis"
81177,Atrophin 1 (ATN1) gene analysis for detection of abnormal alleles
81178,Ataxin 1 (ATXN1) gene analysis for detection of abnormal alleles
81179,Ataxin 2 (ATXN2) gene analysis for detection of abnormal alleles
81180,Ataxin 3 (ATXN3) gene analysis for detection of abnormal alleles
81181,Ataxin 7 (ATXN17) gene analysis for detection of abnormal alleles
81182,Ataxin 8 opposite strand [non-protein coding] (ATXN8OS) gene analysis for detection of abnormal alleles
81183,Ataxin 10 (ATXN10) gene analysis for detection of abnormal alleles
81184,Calcium voltage-gated channel subunit alpha1 A (CACNA1A) gene analysis for detection of abnormal alleles
81185,Calcium voltage-gated channel subunit alpha1 A (CACNA1A) full gene sequence analysis
81186,Calcium voltage-gated channel subunit alpha1 A (CACNA1A) gene analysis for detection of known familial variant
81187,CCHC-type zinc finger nucleic acid binding protein (CNBP) gene analysis for detection of abnormal alleles
81188,Cystatin B (CSTB) gene analysis for detection of abnormal alleles
81189,Cystatin B (CSTB) full sequence gene analysis
81190,Cystatin B (CSTB) gene analysis for detection of known familial variant
81191,Neurotrophic receptor tyrosine kinase 1 (NTRK1) gene analysis for detection of translocation
81192,Neurotrophic receptor tyrosine kinase 2 (NTRK2) gene analysis for detection of translocation
81193,Neurotrophic receptor tyrosine kinase 3 (NTRK3) gene analysis for detection of translocation
81194,"Neurotrophic receptor tyrosine kinase 1,2, and 3 (NTRK1, 2, and 3) gene analysis for detection of translocation"
81200,Aspartoacylase (ASPA) gene analysis for detection of common variant
81201,Adenomatous polyposis coli (APC) full gene sequence analysis
81202,Adenomatous polyposis coli (APC) gene analysis for known familial variants
81203,Adenomatous polyposis coli (APC) gene analysis for deletion variant
81204,Androgen receptor (AR) gene analysis for characterization of alleles
81205,"Branched-chain keto acid dehydrogenase E1, beta polypeptide (BCKDHB) gene analysis for detection of common variant"
81206,Qualitative t(9;22) (BCR/ABL1) translocation analysis for detection of major breakpoint
81207,Qualitative t(9;22) (BCR/ABL1) translocation analysis for detection of minor breakpoint
81208,Qualitative t(9;22) (BCR/ABL1) translocation analysis for detection of breakpoint
81209,"Bloom syndrome, RecQ helicase-like (BLM) gene analysis for detection of 2281del6ins7 variant"
81210,V-raf murine sarcoma viral oncogene homolog B1 (BRAF) gene analysis for detection of V600E variant
81212,"Breast cancer 1 and 2 (BRCA1, BRCA2) gene analysis for detection of 185delAG variant"
81215,Breast cancer 1 (BRCA1) gene analysis for detection of known familial variant
81216,Breast cancer 2 (BRCA2) full gene sequence analysis
81217,Breast cancer 2 (BRCA2) gene analysis for detection of known familial variant
81218,"CCAAT/enhancer binding protein [C/EBP], alpha (CEBPA) full gene sequence analysis"
81219,Calreticulin (CALR) gene analysis for detection of common variant on exon 9
81220,Cystic fibrosis transmembrane conductance regulator (CFTR) gene analysis for detection of common variant
81221,Cystic fibrosis transmembrane conductance regulator (CFTR) gene analysis for detection of known familial variant
81222,Cystic fibrosis transmembrane conductance regulator (CFTR) gene analysis for detection of deletion variant
81223,Cystic fibrosis transmembrane conductance regulator (CFTR) full sequence gene analysis
81224,Cystic fibrosis transmembrane conductance regulator (CFTR) gene analysis with intron 8 poly-T analysis
81225,"Cytochrome P450, family 2, subfamily C, polypeptide 19 (CYP2C19) gene analysis for detection of common variant"
81226,"Cytochrome P450, family 2, subfamily D, polypeptide 6 (CYP2D6) gene analysis for detection of common variant"
81227,"Cytochrome P450, family 2, subfamily C, polypeptide 9 (CYP2C9) gene analysis for detection of common variant"
81228,Cytogenomic constitutional microarray analysis
81229,Cytogenomic constitutional microarray analysis
81230,Cytochrome P450 family 3 subfamily A member 4 (CYP3A4) gene analysis for detection of *2 variant
81231,"Cytochrome P450 family 3 subfamily A member 5 (CYP3A5) gene analysis for detection of *2, *3, *4, *5 *6, and *7 variants"
81232,Dihydropyrimidine dehydrogenase (DPYD) gene analysis for detection of *2A variant
81233,Bruton's tyrosine kinase (BTK) gene analysis for detection of common variants
81234,DM1 protein kinase (DMPK) gene analysis for detection of abnormal alleles
81235,EGFR gene analysis for common variants
81236,Enhancer of zeste 2 polycomb repressive complex 2 subunit (EZH2) full sequence gene analysis
81237,Enhancer of zeste 2 polycomb repressive complex 2 subunit (EZH2) gene analysis for detection of common variants
81238,Coagulation factor IX (F9 ) full gene sequence analysis
81239,DM1 protein kinase (DMPK) gene analysis for characterization of alleles
81240,"Prothrombin, coagulation factor II (F2) gene analysis for detection of 20210G>A variant"
81241,Coagulation Factor V (F5) gene analysis for detection of Leiden variant
81242,"Fanconi anemia, complementation group C (FANCC ) gene analysis for detection of common variant"
81243,Fragile X mental retardation 1 (FMR1) gene analysis for detection of abnormal allele
81244,Fragile X mental retardation 1 (FMR1) gene analysis for characterization of alleles
81245,Fms-related tyrosine kinase 3 (FLT3) gene analysis for detection of internal tandem duplication variant
81246,FLT3 (fms-related tyrosine kinase 3) gene analysis for detection of tyrosine kinase domain (TKD) D835 variant
81247,G6PD (glucose-6-phosphate dehydrogenase) gene analysis for detection of A variant
81248,Glucose-6-phosphate dehydrogenase (G6PD) gene analysis for detection of known familial variant
81249,Glucose-6-phosphate dehydrogenase (G6PD) full gene sequence analysis
81250,"Glucose-6-phosphatase, catalytic subunit (G6PC) gene analysis for detection of common variant"
81251,"Glucosidase, beta, acid (GBA) gene analysis for detection of common variant"
81252,"Gap junction protein, beta 2, 26kDa; connexin 26 (GJB6) full gene sequence analysis"
81253,"Gap junction protein, beta 2, 26kDa; connexin 26 (GJB6) for detection of known familial variants"
81254,"Gap junction protein, beta 6, 30kDa, connexin 30 (GJB6) gene analysis for detection of 232kb [del(GJB6-D13S1854)] variant"
81255,Hexosaminidase A (alpha polypeptide) (HEXA) gene analysis for detection of common variant
81256,Hemochromatosis (HFE) gene analysis for detection of C282Y and H63D variants
81257,Alpha globin 1 and alpha globin 2 (HBA1/HBA2) gene analysis for detection of common deletion
81258,Alpha globin 1 and alpha globin 2 (HBA1/HBA2) gene analysis for detection of known familial variant
81259,Alpha globin 1 and alpha globin 2 (HBA1/HBA2) gene analysis of full gene sequence
81260,"Inhibitor of kappa light polypeptide gene enhancer in B-cells, kinase complex-associated protein (IKBKAP) gene analysis for detection of common variant"
81261,Immunoglobulin heavy chain locus (IGH@) gene rearrangement analysis for detection of abnormal clonal population using amplification method
81262,Immunoglobulin heavy chain locus (IGH@) gene rearrangement analysis for detection of abnormal clonal population using direct probe method
81263,Immunoglobulin heavy chain locus (IGH@) variable region analysis for detection of somatic mutation
81264,Immunoglobulin kappa light chain locus (IGK@) gene rearrangement analysis for detection of abnormal clonal population
81265,Comparative analysis using Short Tandem Repeat (STR) marker
81266,Comparative analysis using Short Tandem Repeat (STR) marker
81267,Chimerism analysis in post transplantation specimen
81268,Chimerism analysis in post transplantation specimen
81269,Alpha globin 1 and alpha globin 2 (HBA1/HBA2) gene analysis for detection of duplication and deletion variants
81270,Janus kinase 2 (JAK2) gene analysis for p.Val617Phe (V617F) variant
81271,Huntington (HTT) gene analysis for detection of abnormal alleles
81272,V-kit Hardy-Zuckerman 4 feline sarcoma viral oncogene homolog (KIT) targeted sequence analysis
81273,V-kit Hardy-Zuckerman 4 feline sarcoma viral oncogene homolog (KIT) gene analysis for detection of D816 variant
81274,Huntington (HTT) gene analysis for characterization of alleles
81275,v-Ki-ras2 Kirsten rat sarcoma viral oncogene (KRAS) gene analysis for detection of variant in codons 12 and 13
81276,Kirsten rat sarcoma viral oncogene (KRAS) gene analysis for additional variants
81277,Cytogenomic neoplasia (genome-wide) microarray analysis wih interrogation of genomic regions for copy number and loss-of-heterozygosity variants for chromosomal abnormalities
81278,IGH@/BCL2 (t(14;18)) qualitative gene analysis for detection of translocation of major breakpoint region and minor cluster breakpoints
81279,Janus kinase 2 (JAK2) targeted sequence gene analysis
81283,"Interferon, lambda 3 (IFNL3) gene analysis for detection of rs12979860 variant"
81284,Frataxin (FXN) gene analysis for detection of abnormal alleles
81285,Frataxin (FXN) gene analysis for characterization of alleles
81286,Frataxin (FXN) full sequence gene analysis
81287,O-6-methylguanine-DNA methyltransferase (MGMT) promoter methylation analysis
81288,"MLH1 (mutL homolog 1, colon cancer, nonpolyposis type 2) gene analysis for detection of methylated variant"
81289,Frataxin (FXN) gene analysis for detection of known familial variant
81290,"Mucolipidosis, type IV (MCOLN1) gene analysis for detection of common variant"
81291,"5,10-methylenetetrahydrofolate reductase (MTHFR) gene analysis for detection of common variant"
81292,"MutL homolog 1, colon cancer, nonpolyposis type 2 (MLH1) full gene sequence analysis"
81293,"MutL homolog 1, colon cancer, nonpolyposis type 2 (MLH1) gene analysis for detection of known familial variant"
81294,"MutL homolog 1, colon cancer, nonpolyposis type 2) (MLH1) gene analysis for detection of deletion and duplication variants"
81295,"MutS homolog 2, colon cancer, nonpolyposis type 1 (MSH2) full sequence gene analysis"
81296,"MutS homolog 2, colon cancer, nonpolyposis type 1 (MSH2) gene analysis for detection of known familial variant"
81297,"MutS homolog 2, colon cancer, nonpolyposis type 1 (MSH2) gene analysis for detection of deletion variant"
81298,MutS homolog 6 (E. coli) (MSH6) full gene sequence analysis
81299,MutS homolog 6 (E. coli) (MSH6) gene analysis for detection of known familial variant
81300,MutS homolog 6 (E. coli) (MSH6) gene analysis for detection of deletion variant
81301,Microsatellite instability analysis of markers for mismatch repair deficiency
81302,Methyl CpG binding protein 2 (MECP2) full gene sequence analysis
81303,Methyl CpG binding protein 2 (MECP2) gene analysis for detection of known familial variant
81304,Methyl CpG binding protein 2 (MECP2) gene analysis for detection of deletion variant
81305,Myeloid differentiation primary response 88 (MYD88) gene analysis for detection of p.Leu265Pro (L265P) variant
81306,Nudix hydrolase 15 (NUDT15) gene analysis for detection of common variants
81307,Partner and localizer of BRCA2 (PALB2 ) full gene sequence analysis
81308,Partner and localizer of BRCA2 (PALB2 ) gene analysis for detection of known familial variant
81309,"Phosphatidylinositol-4, 5-biphosphate 3-kinase, catalytic subunit alpha (PIK3CA) gene analysis of targeted sequence"
81310,Nucleophosmin (NPM1) gene analysis for detection of exon 12 variant
81311,Neuroblastoma RAS viral [v-ras] (NRAS) viral oncogene gene analysis for variants in exon 2 and 3)
81312,Poly[A] binding protein nuclear 1 (PABPN1) gene analysis for detection of abnormal alleles
81313,Measurement of PCA3/KLK3 (prostate cancer antigen 3 and kallikrein-related peptidase 3) ratio
81314,"Platelet-derived growth factor receptor, alpha polypeptide (PDGFRA) gene analysis, targeted sequence analysis"
81315,Qualitative promyelocytic leukemia/retinoic acid receptor alpha (PML/RARalpha) translocation analysis for detection of common breakpoint
81316,Qualitative promyelocytic leukemia/retinoic acid receptor alpha (PML/RARalpha) translocation analysis for detection of single breakpoint
81317,Postmeiotic segregation increased 2 (S. cerevisiae) (PMS2) full gene sequence analysis
81318,Postmeiotic segregation increased 2 gene analysis for detection of known familial variant
81319,Postmeiotic segregation increased 2 (PMS2) gene analysis for detection of deletion variant
81320,Phospholipase C gamma 2 (PLCG2) gene analysis for detection of common variants
81321,Phosphatase and tensin homolog (PTEN) full gene sequence analysis
81322,Phosphatase and tensin homolog (PTEN) gene analysis for known familial variant
81323,Phosphatase and tensin homolog (PTEN) gene analysis for deletion and duplication variants
81324,Peripheral myelin protein 22 (PMP22) gene analysis for deletion and duplication variants
81325,Peripheral myelin protein 22 (PMP22) full gene sequence analysis
81326,Peripheral myelin protein 22 (PMP22) gene analysis for known familial variant
81327,SEPT9 (Septin9) promoter methylation analysis
81328,"Solute carrier organic anion transporter family, member 1B1 (SLCO1B1) gene analysis for detection of *5 variant"
81329,"Survival of motor neuron 1, telomeric (SMN1) dosage/deletion analysis"
81330,"Sphingomyelin phosphodiesterase 1, acid lysosomal (SMPD1) gene analysis for detection of common variant"
81331,Small nuclear ribonucleoprotein polypeptide N and ubiquitin protein ligase E3A (SNRPN/UBE3A gene analysis for detection of methylated variant
81332,"Serpin peptidase inhibitor, clade A, alpha-1 antiproteinase, antitrypsin, member 1 (SERPINA1) gene analysis for detection of common variant"
81333,Transforming growth factor beta-induced (TGFBI) gene analysis for detection of common variants
81334,Runt related transcription factor 1 (RUNX1) gene analysis of exons 3-8
81335,Thiopurine S-methyltransferase (TPMT) gene analysis for detection of *2 and *3 variants
81336,"Survival of motor neuron 1, telomeric (SMN1) full sequence gene analysis"
81337,"Survival of motor neuron 1, telomeric (SMN1) gene analysis for detection of known familial sequence variant"
81338,"MPL proto-oncogene, thrombopoietin receptor (MLP) gene analysis for detection of common variants"
81339,"MPL proto-oncogene, thrombopoietin receptor (MLP) sequence gene analysis of exon 10"
81340,"Beta T cell antigen receptor (TRB@) gene rearrangement analysis for detection of abnormal clonal population, using amplification method"
81341,"Beta T cell antigen receptor (TRB@) gene rearrangement analysis for detection of abnormal clonal population, using direct probe method"
81342,Gamma T cell antigen receptor (TRG@) gene rearrangement analysis for detection of abnormal clonal population
81343,Protein phosphatase 2 regulatory subunit Bbeta (PPP2R2B) gene analysis for detection of abnormal alleles
81344,TATA box binding protein (TBP) gene analysis for detection of abnormal alleles
81345,Telomerase reverse transcriptase (TERT) gene analysis of promoter region
81346,Thymidylate synthetase (TYMS) gene analysis for detection of common variant
81347,Splicing factor [3b] subunit B1) (SF3B1) gene analysis for detection of common variants
81348,Serine and arginine-rich splicing factor 2 (SRSF2) gene analysis for detection of common variants
81349,Cytog alys chrml abnr lw-ps
81350,"UDP glucuronosyltransferase 1 family, polypeptide A1 (UGT1A1) gene analysis for detection of *28 variant"
81351,Tumor protein 53 (TP53) full sequence gene analysis
81352,Tumor protein 53 (TP53) targeted sequence gene analysis
81353,Tumor protein 53 (TP53) gene analysis for detection of known familial variant
81355,"Vitamin K epoxide reductase complex, subunit 1 (VKORC1) gene analysis for detection of common variant"
81357,U2 small nuclear RNA auxiliary factor 1 (U2AF1) gene analysis for detection of common variants
81360,"Zinc finger CCCH-type, RNA binding motif and serine/arginine-rich 2 (ZRSR2) gene analysis for detection of common variants"
81361,"Hemoglobin, subunit beta (HBB) gene analysis for detection of HbC variant"
81362,"Hemoglobin, subunit beta (HBB) gene analysis for detection of known familial variant"
81363,"Hemoglobin, subunit beta (HBB) gene analysis for detection of deletion and duplication variants"
81364,"HBB (hemoglobin, subunit beta) full gene sequence analysis"
81370,"Low resolution human leukocyte antigen (HLA) Class I and II typing of HLA-A, HLA-B, HLA-C, HLA-DRB1/3/4/5, and HLA-DQB1"
81371,"Low resolution human leukocyte antigen (HLA) Class I and II typing of HLA-A, HLA-B, and HLA-DRB1/3/4/5"
81372,Complete low resolution human leukocyte antigen (HLA) Class I typing
81373,Low resolution human leukocyte antigen (HLA) Class I typing of locus
81374,Low resolution human leukocyte antigen (HLA) Class I typing of antigen equivalent
81375,Low resolution human leukocyte antigen (HLA) Class II typing of HLA-DQB1
81376,Low resolution human leukocyte antigen (HLA) Class II typing of locus
81377,Low resolution human leukocyte antigen (HLA) Class II typing of antigen equivalent
81378,"High resolution human leukocyte antigen (HLA) Class I and II typing of HLA-A, HLA-B, HLA-C,and HLA-DRB1/3/4/5"
81379,Complete high resolution human leukocyte antigen (HLA) Class I typing
81380,High resolution human leukocyte antigen (HLA) Class I typing of locus
81381,High resolution human leukocyte antigen (HLA) Class I typing of allele
81382,High resolution human leukocyte antigen (HLA) Class II typing of locus
81383,High resolution human leukocyte antigen (HLA) Class II typing of allele group
81400,Level 1 molecular pathology procedure
81401,Level 2 molecular pathology procedure
81402,Level 3 molecular pathology procedure
81403,Level 4 molecular pathology procedure
81404,Level 5 molecular pathology procedure
81405,Level 6 molecular pathology procedure
81406,Level 7 molecular pathology procedure
81407,Level 8 molecular pathology procedure
81408,Level 9 molecular pathology procedure
81410,"Aortic dilation gene deletion analysis for detection of FBN1, TGFBR1, TGFBR2, COL3A1, MYH11, ACTA2, SLC2A10, SMAD3, and MYLK variants"
81411,"Aortic dilation gene deletion analysis for detection of TGFBR1, TGFBR2, MYH11, and COL3A1 variants"
81412,Ashkenazi jewish associated disorders genomic sequence analysis panel
81413,"Cardiac ion channelopathies duplication/deletion gene analysis panel with sequencing of 10 or more genes, including ANK2, CASQ2, CAV3, KCNE1, KCNE2, KCNH2, KCNJ2, KCNQ1, RYR2, and SCN5A"
81414,"Cardiac ion channelopathies duplication/deletion gene analysis panel with analysis of at least genes, including KCNH2 and KCNQ1"
81415,Exome sequence analysis
81416,Exome sequence analysis
81417,Exome sequence analysis
81419,"Epilepsy genomic sequence analysis panel, including ALDH7A1, CACNA1A, CDKL5, CHD2, GABRG2, GRIN2A, KCNQ2, MECP2, PCDH19, POLG, PRRT2, SCN1A, SCN1B, SCN2A, SCN8A, SLC2A1, SLC9A6, STXBP1, SYNGAP1, TCF4, TPP1, TSC1, TSC2, and ZEB2"
81420,Fetal chromosomal aneuploid genomic sequence analysis
81422,Fetal chromosomal microdeletion genomic sequence analysis of circulating cell-free fetal DNA in maternal blood
81425,Genome sequence analysis
81426,Genome sequence analysis
81427,Genome sequence analysis
81430,"Hearing loss genomic sequence analysis panel including CDH23, CLRN1, GJB2, GPR98, MTRNR1, MYO7A, MYO15A, PCDH15, OTOF, SLC26A4, TMC1, TMPRSS3, USH1C, USH1G, USH2A, and WFS1 genes"
81431,Hearing loss gene analysis for detection of deletion and duplication variants including STRC and DFNB1 deletions in GJB2 and GJB6 genes
81432,Hereditary breast cancer related disorders genomic sequence analysis
81433,"Breast cancer (BRCA1, BRCA2, MLH1, MSH2, STK11) gene analysis for detection of duplication and deletion variants"
81434,"Retinal disorders (ABCA4, CNGA1, CRB1, EYS, PDE6A, PDE6B, PRPF31, PRPH2, RDH12, RHO, RP1) genomic sequence analysis"
81435,"Hereditary colon cancer syndrome genomic sequence analysis panel including APC, CHEK2, MLH1, MSH2, MSH6, MUTYH, and PMS2 genes"
81436,"Hereditary colon cancer syndrome gene analysis for detection of deletion and duplication variants including APC, MLH1, MSH2, MSH6, PMS2, EPCAM, CHEK2, and MUTYH genes"
81437,"Neuroendocrine tumor disorders (MAX, SDHB, SDHC, SDHD, TMEM127) genomic sequence analysis"
81438,"Neuroendocrine tumor disorders (SDHB, SDHC, SDHD, VHL) gene analysis for detection of duplication and deletion variants"
81439,Hereditary cardiomyopathy genomic sequence analysis
81440,"Mitochondrially encoded genomic sequence panel for detection of BCS1L, C10orf2, COQ2, COX10, DGUOK, MPV17, OPA1, PDSS2, POLG, POLG2, RRM2B, SCO1, SCO2, SLC25A4, SUCLA2, SUCLG1, TAZ, TK2, and TYMP genes"
81442,"Noonan spectrum disorders genomic sequence analysis panel including BRAF, CBL, HRAS, KRAS, MAP2K1, MAP2K2, NRAS, PTPN11, RAF1, RIT1, SHOC2, and SOS1"
81443,Genomic sequence analysis of 15 or more genes for detection of severe inherited conditions
81445,Hematolymphoid neoplasm genomic sequence analysis panel with DNA analysis
81448,Hereditary peripheral neuropathies panel genomic sequence analysis
81450,Hematolymphoid disorder genomic sequence analysis panel with DNA analysis
81455,Hematolymphoid neoplasm genomic sequence analysis panel
81460,Mitochondrially encoded genomic sequence analysis with detection of heteroplasmy
81465,Mitochondrially encoded genomic sequence analysis for detection of deletion and heteroplasmy variants
81470,"X-linked intellectual disability (XLID) genomic sequence analysis panel including ARX, ATRX, CDKL5, FGD1, FMR1, HUWE1, IL1RAPL, KDM5C, L1CAM, MECP2, MED12, MID1, OCRL, RPS6KA3, and SLC16A2 genes"
81471,"X-linked intellectual disability (XLID) gene analysis for detection of deletion and duplication variants including ARX, ATRX, CDKL5, FGD1, FMR1, HUWE1, IL1RAPL, KDM5C, L1CAM, MECP2, MED12, MID1, OCRL, RPS6KA3, and SLC16A2 genes"
81479,Molecular pathology procedure
81490,Analysis of biomarkers using immunoassay for autoimmune arthritis
81493,Coronary artery disease (mRNA) gene expression analysis by real-time PCR of 23 genes
81500,Biochemical assay of two proteins including CA-125 and HE4 utilizing serum for ovarian cancer
